Victim founded hanging in her room along with death note stating reason of death,302
Deceased died due to firing from the gun with which accused was armed,302
"Accused confronted deceased under mango tree near fields, abused him and struck spear blow on left side of lumber region . Victim died on the spot while accused ran away with spear",302
Accused-appellant charged with attacking and injuring his step-mother (deceased) in rage of violent behaviour with axe . Deceased found death at the spot,302
Offence for causing gunshot injuries to three children who were on rickshaw,302
Accused along with co-accused surrounded the victim and discharged five or six shots by their firearms with an intention to commit murder,302
Applicant had assaulted the deceased by repeated deadly blows,302
"Five men-members of the same family-assaulted an unarmed man and beat him with rods . They knocked him down and continued beating him, with the result that he died then and there.",302
Accused gunshot his brother over land dispute . Victim was taken to hospital but found dead while transfering,302
Accused planned death of her husband with co-accused because of his affair,302
accused managed to hit the victim on the head which cause on the spot death,302
Murder by knocking down the deceased by car,302
Murder  of six family members including two minor children below 10 yrs by drugging them with sleeping tablets and pushing them into canal,302
The appellant-accused persons were charged for the offences of kidnapping and gang raping a minor girl and criminal intimidation and wrongful detention. ,375
rape have been committed on prosecutrix in the presence of so many members of the family in a small house,375
"Instant case of rape and murder of 4 year old child by appellant-accused, who was 25 yrs of age at the relevant time",375
"The appellant-accused was a friend of the brother of the prosecutrix. The accused used to come to the house of the prosecutrix quite often to meet her brother and also used to talk to her. According to the prosecution, on 17-9-1997, when the prosecutrix was proceeding at about 8.30 a.m. to the place of employment from her house, the accused caught hold of her by the hand and forcibly took her to a nearby property on the side of a public road and committed rape on her, without her consent.",375
"Prosecutrix aged about 14 yrs had, at around 7.30 p.m., gone to answer the call of nature, when appellant allegedly came from behind, gagged her mouth, brandished a knife and forced her towards coal depot of accused S  where she was raped by appellant and four others",375
"Prosecutrix was a married woman and was overpowered by several men before she was raped — She was obviously not in a position to resist and to fight several men, who had threatened her with death",375
"On 20-10-2012 A-1 picked up victim (PW 5) aged about 16 yrs and took her in a car to a restaurant along with his friend A-2 — Appellants forcibly gave soft drink mixed with intoxicant to victim and after taking said drink, she fell unconscious — Thereafter appellants committed rape on her",375
Victim prosecutrix (PW 10) forcibly taken to nearby school by appellant and other co-accused — There she was raped by all resulting in prosecutrix falling unconscious,375
"On 31-7-2002, at around 10 a.m., prosecutrix, aged 12 years, had gone to the jungle to graze buffaloes. Accused s , whose house was in the jungle lured her to his house. No one was there in the house and S  closed the door from inside, forcibly undressed her and made her to lie on the ground and started raping her forcibly",375
Nine year old prosecutrix (PW 4) has categorically stated that respondent-accused made her sleep with him and that respondentaccused used to take off her clothes and his own clothes and that he used to insert his private part inside her private part,375
victim was raped and killed by crushing her head with a stone,375
Repeated rape and sodomy of minor by her guardian (who wanted to bring up the minor as his own daughter) over a period of time,375
"Appellant 1 in absence of parents of prosecutrix at home, asked her to go with him for harvesting wheat crop, and accordingly, she accompanied him to residence of Appellant 2 , where she was sexually assaulted by both appellant",375
"A girl lodged a complaint on 29-11-1988 to the police stating that she and the accused-appellant were neighbours. They fell in love with each other and one day in February 1988, the accused forcibly raped her and later consoled her saying that he would marry her,",375
Rape followed by murder caused by burning which had caused extensive second degree burns on front side of whole body of victim,375
"Prosecutrix , aged about 19 yrs, was married, and had an infant daughter at the time of incident. On the day of incident, at 5.00 p.m., both appellant-accused, upon finding prosecutrix working alone in her field, gagged her and committed rape on her in turns",375
"The accused-respondent is the son of maternal uncle of prosecutrix's father who is the informant. The informant complained that the accused used to visit their house often and enticed her daughter and cheated her, promising to marry her and had regular sexual intercourse with her on this pretext.",375
"The prosecution case was that the four respondent-accused who were living in the neighbourhood of the jhuggi camp where the prosecutrix was living, had entered the jhuggi of the prosecutrix at about 9.00 p.m. on 28-7-1997 and that while Respondent 2 caught hold of her hands, other three accused had torn her clothes and committed rape on her in turn",375
"In the instant case, the prosecutrix, PW 9, lodged FIR on 13-4-1999, alleging, that 4 years ago, the appellant-accused had outraged her modesty at the point of a knife. He had since been promising to marry her, and on that pretext, continued to establish physical relations with her as husband and wife.",375
Accused-appellant kidnapped minor below the age of 16 yrs (case thus falling under S. 375 Sixthly) and enticed her away to marry and had sexual intercourse,375
Sexual intercourse with blind girl on the pretext of marriage by classmate of her brother,375
"Rape and sodomy of 10 yr old girl and murder of her 7 year old brother along with her, first by trying to poison them and then by throwing them to canal in their conscious state",375
Rape of own daughter regularly for five years after the wife left petitioner-accused and producing a child from her,375
"Appellant pretending to be a priest, cheated and committed rape upon helpless victim of his daughter's age",375
Brutal rape of a young child aged 7/8 years by the appellant aged 31 years leading to her death due to excessive bleeding,375
"Appellant-accused, ball picker in a university tennis court, allegedly enticing minor victim (11 yrs old at time of incident), working as maid in staff quarters of university, to tennis court storeroom, and committing rape on her",375
"Allegedly A1, on 31-7-1993 abducted PW 2 (victim prosecutrix) with the help of A2, A4 and A5 when she declined his proposal to marry him. A1 then forcibly married her in a temple and committed rape on her for three days",375
"The appellant, aged 32 years, came to the house of his neighbour PW 1, and stayed with his four children as PW 1 and his wife had gone to irrigate agricultural fields in the night. The appellant was on visiting terms with the family, and the children used to call him “mama”. Around midnight, he raped the prosecutrix aged 14 years.",375
"Appellant committed rape upon prosecutrix and threatened her of dire consequences with her photographs and her conversations with him recorded on his mobile phone, if she raised an alarm",375
"Appellants came in the night in a jeep armed with deadly weapons, told father to give his daughter as a wife to appellant R .and on his refusal he had been threatened on which he ran away from the spot — Prosecutrix was forcibly taken to jungle and repeatedly raped over a period of five days",375
Petitioner-accused and victim working for same organisation and petitioner-accused being superior of victim — Allegation that petitioner-accused committed rape on her,375
"This witness has stated that the detenu and his associates extort money at the point of weapons from businessmen, shopkeepers and hawkers of the area; that whoever refuses to give them hapta money are threatened by them and that out of fear nobody complains against them.",383
the prejudicial activities of the petitioner and his associates of the activities of indulging in extorting ransom amounts under threat of deadly weapons from the businessmen and scene was recorded in camera,383
"the petitioner and his associates always possessed deadly weapons such as revolver, knife and chopper and that the petitioner and his associates pretended to be members of Rajan Gang and they terrorised and extorted money from the businessmen and common public of the same locality.",383
"They often extort money from the witness and from small scale business persons. The vegetable cart of the witness was burnt in the riots, which occurred in the month of October 2002, hence, the witness did not pay the amount to the associates of the detenu.",383
a contract of repairs 15 of 25 APL.289.2016 from the Gram Panchayat and had not paid money to the Applicant no.1 who was a Sarpnch. The first informant was threatened that he will have to face dire consequences and that he will be killed in the event he does not pay the amount demanded by them.,383
Dr. Sudhir Krishna and Mr. H.S. Shekhawat and Dr. Kapil for extorting resignation from me and for threatening to see me and ruin my career.,383
"It was alleged that respondent had threatened him & demanded ` 10.00 Lacs. Also threatened in case of non-payment, he should be ready to face the music and in that eventuality he would eliminate him and his family.",383
"The accused earns money by exploitation, blackmail and extortion by use of the name of Abu Saleem of notorious Dawood outfit; his having extorted Rs. 50 lakhs on 15.10.1997 and Rs. 1 crores on 16.10.1997 from K.C. Lakhani, Rs. 15 lakhs in January, 1998 and Rs. 20 lakhs on 1.5.1998",383
"on the fateful day when he was ready to go to his office and had opened the back door of his house, at that time three boys came from the side of the park and all of a sudden surrounded him; he took out a knife from his apparel and extorted him to hand over all the articles which he had; and other two took out kattas to make him silent",383
the officer present at the Immigration Counter harassed her by saying that the photograph on her passport is not hers and the officer demanded `800/- for granting immigration clearance to her; which sum she paid.,383
It was alleged against him that he had threatened the concerned Ammunition-in- charge(s) of 21 Assam Rifles by using abusive language and telling them that his reporting of irregularities would invite their trial by court martial and termination of services and demanded money to cover up the same.,383
"Haripal went to the said flat and has been served tea, where after consuming the said tea he was unconscious and when he regained the consciousness then the petitioner along with her co-accused namely Surender, Meenu Handa and Rajesh gave a threat to this Haripal and demanded Rs.20 lakhs from him otherwise threatened to register a false case of rape.",383
"It was alleged that while leaving the shop, both the persons threatened the complainant that in case extortion amount was not paid, complainant would have to face the consequences. It was alleged that he was so terrified that he did not report the matter to the police.",383
"particularly taking note of the collusion of Police Officials in the criminal cases registered, extortion of about Rs.3 crores from the Directors by kidnapping one of the Director, etc.",383
"in the year 1999 she was taken to Court and asked to sign on a paper; when she refused to sign, Somdeb Gupta and his two sons Dr. Subhranshu Gupta and Dr. Anish Gupta compelled her to sign on the paper.",383
"The accused/respondent is alleged to have played a major role in fixing these matches, as it is alleged by the petitioner/State that he was the main link between the players and an alleged Syndicate which was running betting on these matches and had profited hugely from these match fixings as they controlled the outcome of each of these matches.",383
"When the defacto complainant refused to pay a sum of Rs. 50,000/-, he was abused in filthy language and was threatened with dire consequences.",383
"the spouse had an affair with three married people and demanding that each person pay you 5,000 Rs each or else you will alert their families about their affairs",383
It is alleged that after fetching her confidence and trust the applicant is alleged to have clicked few pictures of the complainant bordering obscenity and prepared videos. The applicant is alleged to have blackmailed her for extortion.,383
"on 14.12.2005, they have received a call on their landline no. 229137 installed in their shop which was attended to by the deceased and the caller identified himself to be accused Baljit Singh alias Jeeta of village Badshikri and had raised a demand of ransom amount of Rs 50 lacs",383
"Per contra, learned Panel Lawyer for the State opposes the application with the submission that applicants in fact had hatched conspiracy and forced the complainant for their illegal demands",383
He was extorting money from inhabitants of that area and he died in suspicious condition. Later on the police has concocted false case on the basis of interested and partisan witnesses against the applicants though the witnesses have not seen the incident.,383
the applicant/accused tried to extort money from the complainant by threatening to kill her and abused her on phone,383
"Virendra Dwivedi and co-accused Mayank Mishra threatened Ramesh Jaiswal and Shyamlal Jaiswal to implicate them in a case of excise, and extorted money from them.",383
"a history-sheeter with 30 serious criminal cases pending against him, instrumental in kidnapping victim under threat, and for confining and torturing him in confinement",364
"The victim, Anuva Mondal, was a school-going minor girl. She was kidnapped by the accused, Sk. Manu",364
"Accused allegedly kidnapped the victim, a student of VIth Standard in his auto and took him to his sister's house and telephoned to victim's father demanding Rs 2 lakhs for release of his son",364
"The appellant in this case is one Sheik Dawood Sahib aged 27. He has been convicted  for having kidnapped a girl named Krishnaveni, aged 16 to 17, out of the keeping of P. W. 2 her father and lawful guardian, without the consent of such guardian",364
Boy of Seven years kidnapped for ransom,364
"the instant case a young boy, aged about 16 years, son of a goldsmith kidnapped from his school for ransom by the appellants,",364
"Though it is true that there was a love affair between PW 1 (victim) and the appellant, on the date of incident the appellant along with 5 other persons did come in a tempo and tried to kidnap PW 1 at about 10 p.m.",364
"PW 2, a college student, was abducted by the appellant and three others (who were acquitted by the trial court). They asked him his father's phone number and stated that a demand of Rs 4,00,000 would be made for his release",364
It is a case of Kidnapping Deceased used to go for morning walk — He was sighted by PW 13 who also used to go for morning walk — PW 3 had witnessed a person being pushed into a Maruti van by three persons and the van going away followed by a motorcycle.,364
Appellant prosecuted for kidnapping  two boys aged 10 to 12 years,364
"three person forcibly took away a 4 years old boy, causing grievous hurt to her mother and gave a written threat to the life of the boy if Rs 5 lakhs were not paid. ",364
According to complainant seven men from his family were abducted by the police on 29-10-1991 and he sought their release apprehending they may be killed,364
Respondents assaulting the deceased and taking him away in a truck with declaration that they would kill him,364
"Accused kidnapped minor girl, aged about 15 yrs",364
"Accused persons including appellant kidnapping PW 2, a nine-year-old child — They demanding a ransom of Rs ten lakhs and threatening to kill PW 2 if said amount not paid",364
"it is established that offender after kidnapping a person keeps him in detention or threatens to cause death or hurt in order to extort ransom, and communicates that demand",364
Appellant-accused involved in abduction and murder of a former MLA along with 17 others,364
"instant case pertains to the abduction of PWs 17, 18 and 20, which was committed for extracting ransom",364
"Victim, aged about six years, was allegedly kidnapped by accused persons Demand of Rs 60 lakhs as ransom for releasing victim was made on telephone",364
"Planned kidnapping of 3 minor children aged about 8, 6 and 4 yrs for taking revenge",364
Kidnapping in order to compel marriage,364
Kidnapping of two children aged 6 and 8 years ,364